"Status","Start Time","Stop Time","Duration in ms","Parent Suite","Suite","Sub Suite","Test Class","Test Method","Name","Description"
"passed","Thu Apr 09 12:06:59 GMT 2020","Thu Apr 09 12:07:11 GMT 2020","11202","","Free blocks Pinterest block","","Free blocks Pinterest block","Can publish a post with a Pinterest block","Can publish a post with a Pinterest block",""
"passed","Thu Apr 09 12:04:59 GMT 2020","Thu Apr 09 12:05:14 GMT 2020","15599","","Paid blocks Mailchimp Block","","Paid blocks Mailchimp Block","Can publish a post with a Mailchimp Block","Can publish a post with a Mailchimp Block",""
"passed","Thu Apr 09 12:05:24 GMT 2020","Thu Apr 09 12:05:30 GMT 2020","5033","","Paid blocks WordAds block","","Paid blocks WordAds block","Can publish a post with a WordAds block","Can publish a post with a WordAds block",""
"passed","Thu Apr 09 12:07:28 GMT 2020","Thu Apr 09 12:07:32 GMT 2020","3552","","Jetpack connection","","Jetpack connection","Can find connect button on plugins page","Can find connect button on plugins page",""
"passed","Thu Apr 09 12:07:33 GMT 2020","Thu Apr 09 12:07:34 GMT 2020","1668","","Jetpack connection","","Jetpack connection","Can find connect button on Jetpack page","Can find connect button on Jetpack page",""
"passed","Thu Apr 09 12:05:14 GMT 2020","Thu Apr 09 12:05:24 GMT 2020","10051","","Paid blocks Simple Payment","","Paid blocks Simple Payment","Can publish a post with a Simple Payments block","Can publish a post with a Simple Payments block",""
"passed","Thu Apr 09 12:07:11 GMT 2020","Thu Apr 09 12:07:19 GMT 2020","8397","","Free blocks Eventbrite block","","Free blocks Eventbrite block","Can publish a post with a Eventbrite block","Can publish a post with a Eventbrite block",""
"passed","Thu Apr 09 12:07:32 GMT 2020","Thu Apr 09 12:07:33 GMT 2020","935","","Jetpack connection","","Jetpack connection","Can find connect button on dashboard page","Can find connect button on dashboard page",""
